subreddit,post_id,title,body,author,upvotes,number_of_comments,created_utc,ticker_symbols,source
wallstreetbets,1ra00b2,Weekly Earnings Thread 2/23 - 2/27,,OSRSkarma,200,700,1771604926,,reddit
wallstreetbets,1rdeei8,Daily Discussion Thread for February 24  2026,This post contains content not supported on old Reddit. [Click here to view the full post](https://sh.reddit.com/r/wallstreetbets/comments/1rdeei8),wsbapp,53,727,1771934496,,reddit
wallstreetbets,1rd3460,OpenAI cuts spending plan to $600B from $1.4T through 2030,They also expect $280B in revenue in 2030 from $13B last year  so I guess subsidized AIs might slowly fade away. I wonder how this will affect AI adoption when the companies’ bills from OpenAI start multiplying.,donopumpi,5795,581,1771902189,AI,reddit
wallstreetbets,1rddbev,FedEx sues for refund of Trump tariffs  days after Supreme Court ruling,,GringottsWizardBank,553,72,1771931223,,reddit
wallstreetbets,1rdchxg,Anthropic’s Grim Reaper Week,,phoneixAdi,409,55,1771928291,,reddit
wallstreetbets,1rcw869,IBM crashed 13% because the market found out LLMs can write code  bought $190k,Totally insane drop     Easiest buy of the year    https://preview.redd.it/lpbk2nqdmblg1.png?width=712&amp;format=png&amp;auto=webp&amp;s=5d8c907d278a5d8e71b3392c453a8f7d8ae800ef       https://preview.redd.it/6ledavfcmblg1.png?width=941&amp;format=png&amp;auto=webp&amp;s=3f45299d1eafe6b07657b3a19edac2d9c27b1aaa  ,GreatGapYoukai,2549,471,1771885883,IBM,reddit
wallstreetbets,1rdeku3,AMD clinches second mega chip supply deal  this time with Meta,,Vivid_Giraffe_208,138,42,1771935052,AMD,reddit
wallstreetbets,1rczm5m,Are the Claude fears legit or extremely overblown?,Personally  I feel like this is a huge buy the dip opportunity for generational wealth. But I would love the opinion and get a discussion going with others who are more informed. ,chizton,889,877,1771893730,,reddit
wallstreetbets,1rcmijp,Paypal Halted following Takeover report.,,CryptoBoy-007,2291,287,1771865024,,reddit
wallstreetbets,1rcofsj,Data centres seek credit ratings to unlock billions in funding for AI push,Another bubble in the making 📈📉,ud30,1121,184,1771869074,AI,reddit
wallstreetbets,1rcv2vy,Uber acquiring parking app SpotHero,,Regular_Eggplant_248,420,56,1771883318,,reddit
wallstreetbets,1rcv8bt,I see fat people everywhere - 100k on NVO,Like title said  I keep seeing fat people everywhere I go. They are now valued at even cheaper than pre- ozempic price. And pill forms about to come out. WHO doesn’t want skinny pills. 2500 shares  @ $39.73,DingDongDingDong6969,353,129,1771883647,NVO|WHO,reddit
wallstreetbets,1rc58xh,Bitcoin falls below $65 000 as Trump tariff moves raise uncertainty,&gt;tldr:  &gt;Bitcoin fell more than 5% to below $65 000 on Monday after U.S. President Donald Trump announced plans to raise global tariffs to 15%.  &gt;The drop came as Asian equities rose in early trade  underscoring crypto’s divergence from regional stock markets amid renewed tariff uncertainty.,sandygws,17726,1491,1771813633,,reddit
wallstreetbets,1rcerpx,Novo Nordisk sinks 15% after weight loss drug fails to match Eli Lilly's in trial,rip bagholders ,Independent-Cress382,1716,187,1771845399,,reddit
wallstreetbets,1rcorvh,I decided to be a 🌈 🐻 today 0DTE,I was down 200k since April  YOLO’d 50k into 0DTE spy puts a few minutes after open today. I’m broken even again  I need to stop now  I definitely have a problem.,Jojn20,420,98,1771869776,DTE|YOLO,reddit
wallstreetbets,1rc61v8,AMA: My name is Jensen Huang and I'm here to save the S&amp;P  ask me anything..,,ImadeJesusLaugh,7114,756,1771815868,AMA,reddit
wallstreetbets,1rctrhb,What Are Your Moves Tomorrow  February 24  2026,This post contains content not supported on old Reddit. [Click here to view the full post](https://sh.reddit.com/r/wallstreetbets/comments/1rctrhb),wsbapp,210,7406,1771880301,,reddit
wallstreetbets,1rcpcnr,HIMS YOLO BEFORE EARNINGS WENT ALL IN! 🚀,Bought 21700 shares. ChatGPT is predicting this goes to $19.80 after earnings with breakout chance to $22 at 60-80% probability.  Decided to YOLO my life savings on this. Wish me luck! Screenshots of my position and ChatGPT prediction attached. ,Striking-Cattle3255,338,410,1771870979,HIMS|YOLO|EFORE|NINGS|WENT|GPT,reddit
wallstreetbets,1rcvcux,420% Gain on 0DTE Puts,Bought 10 contracts a few minutes after open and sold about an hour before close. Results not typical  consult your financial advisor before investing.,ChazHollywood,117,16,1771883934,DTE,reddit
wallstreetbets,1rcm8yl,70K loss,POV when you have thousands of stocks to pick from and you pick the worst 3,Big-Quote4483,260,96,1771864462,POV,reddit
wallstreetbets,1rck7h9,Triple downed on $MSFT $405 March 6th calls after being down ~80%,&amp;#x200B;  I've brought my average cost down to $6.30. Hoping to catch a pump and break even. Learn from my mistakes folks  and never go full regard.,Paul_Robert_,235,175,1771859954,MSFT,reddit
wallstreetbets,1rbzn1f,The moment I buy a thousand dollars worth of puts,,lancehall08,5151,125,1771799024,,reddit
wallstreetbets,1rcgvp3,F#ck Febru@ry,,JobItchy9815,296,107,1771851869,,reddit
wallstreetbets,1rbw3o9,AWS suffered ‘at least two outages’ caused by AI tools  and now I’m convinced we’re living inside a ‘Silicon Valley’ episode,,WrongThinkBadSpeak,4580,132,1771790978,AWS|AI,reddit
wallstreetbets,1rcrbby,Short IBM,Anthropic released a new tool that kills IBM's business. It says now the work can be done in quarters instead of years,TransformersScorge,47,45,1771875093,IBM,reddit
wallstreetbets,1rcfmem,Daily Discussion Thread for February 23  2026,This post contains content not supported on old Reddit. [Click here to view the full post](https://sh.reddit.com/r/wallstreetbets/comments/1rcfmem),wsbapp,192,12098,1771848138,,reddit
wallstreetbets,1rcjxaz,Getting my Shiny Rocks off,,Locke_____Lamora,72,19,1771859313,,reddit
wallstreetbets,1rcmeqn,Doubled down on HOOD and MSFT,Hope this pays off over 2026 😴 gonna check back in a couple weeks (5 minutes),uPVot3WhoRE,55,44,1771864805,HOOD|MSFT,reddit
wallstreetbets,1rbrk14,How can I short an entire country?,,-colin-,3812,328,1771780783,,reddit
wallstreetbets,1rcongo,Just another Monday,,JamerTheGamer,32,7,1771869540,,reddit
wallstreetbets,1rcmemz,Doubled down on HOOD and MSFT,Hope this pays off over 2026 😴 gonna check back in a couple weeks (5 minutes),uPVot3WhoRE,38,37,1771864800,HOOD|MSFT,reddit
wallstreetbets,1rclu8u,Sold my U calls. Hopefully this helps us all.,Prayge,kananishino,38,13,1771863581,,reddit
wallstreetbets,1rcm2pa,God i hate my paperhands,,NocturnalCereal,26,13,1771864092,,reddit
wallstreetbets,1rcos5a,It’s all in tech stocks with a heavy tqqqqq yes leverage 5 Nasdaq,,Signal_Ad8032,15,13,1771869791,,reddit
wallstreetbets,1rc8zot,I just went all in on CRSR after 5 years of pain,**TLDR:** I 15x’d my CRSR position. Memory supply is tight  Crucial is exiting leaving a window of opportunity in the consumer memory segment  insiders are finally buying  stock buybacks have started  and in 15 years in this industry I have never seen a cycle like this. Either this is a structural bottom  or I just crowned myself the ultimate CRSR bagholder.  I've gone back and forth on posting this for the last month because if I am wrong  this will be a very public and very expensive lesson. There has been very little talk about this stock anymore even after the recent earnings report  which tells me sentiment is crushed  but I have been dying to know whether I am missing something or seeing something others are not.  So I bought \~35k worth of CRSR in 2021 and it has been a painful and very consistent memory ever since. I know many here have encountered the same grind  but I assume not many would have leaned in as hard as I did. Apparently five years of losses was not enough for me  so over the last month  I convinced myself to buy another 500k worth which represents almost everything I have that is tangible. Until earnings lined up with what I suspected  I was straight up unwell for weeks. The day after I bought a sizeable amount  it ticked up about fifteen cents and I briefly thought I was a genius. Fifteen minutes later it rolled over and I was back to watching the same five year bloodbath. I even cut coffee for a few days thinking maybe the anxiety was self inflicted. It was not the caffeine.  For context  I am the CEO of Eluktronics. We build enthusiast grade gaming laptops. We are not direct competitors with Corsair in most categories  but we have shared some suppliers  live through the same component cycles  and cater to the same performance focused market.  I handle allocation  build of materials pricing  and supplier negotiations daily and have for fifteen years. I have lived through multiple memory cycles and this one is not normal.  The reason I made what is easily the scariest purchase of my life started with a missed opportunity in Micron. I did not buy before earnings  despite aggressively securing their product for our own business the last few months while watching the prices rise  and that mistake forced me to step back and reassess what is happening in memory and storage.  As many know  the PC industry ran into a perfect storm. OpenAI locked up major DRAM supply for 2026 with SK Hynix and Samsung  Micron exited the consumer segment  and panic followed for OEMs  system integrators  distributors  retail and businesses.  Before the AI surge  we could buy 32GB SODIMMs as low as $75 each.  Now we're lucky to find quality memory for less than $315 each.  High-end 2TB SSDs we were sourcing for \~$120 are now several multiples of that. I still cannot reconcile how quickly those numbers escalated and they are not stabilizing.  What caught my attention even more than pricing was supply behavior. In fifteen years I have never seen module assemblers go nearly bone dry. I can almost always get a quote even if it is painful. This time I had most vendors tell me they literally had nothing to sell and one sales rep admitted he was probably going to lose his job. Retail has always lagged disti pricing because inventory and deals are often planned months in advance. In many instances  especially this time around  I was buying components for significantly less than we could even buy from direct vendors or distributors so I started buying as much as I could from retail that made sense.  After seeing Micron and Sandisk earnings  it became obvious that whoever still had supply in this environment was benefiting. That is what led me to dig deeper again into Corsair. They were one of the only module vendors that still had product available across Amazon  Best Buy  Micro Center  B&amp;H  Newegg &amp; distribution. Meanwhile Team Group  Silicon Power  Adata  Mushkin and others were selling out and some have yet to restock. I initially assumed that as a global supplier Corsair might be diverting inventory into the U.S. to maintain presence here. That turned out not to be the case. I also monitored Amazon's transparent sales indicators like the “500+ bought in the last month” tags. Most of their product was not sitting idle. It was still moving while prices were climbing mountains.  Crucial is stepping out of this segment as Micron pulls back from the consumer side. We will see this play out more in Q2 since they announced February as their planned end  but I have already seen multiple SKU discontinued notices on retail sites like B&amp;H.  That removes the most meaningful branded competitor from the retail channel  since Samsung and SK Hynix do not sell memory to retail. With supply for consumers about to get even worse and one of the most recognized names leaving  someone else is going to win out.  On a prior CRSR earnings call  management mentioned they had secured DRAM ahead of the spike. At the time  I wondered just how much that meant. Seeing them consistently in stock  while others were running dry suggests that comment and judgement call on their end was monumental.  All of this leads to my core thesis. This memory cycle looks structurally different than anything I have seen in fifteen years  Corsair appears to have secured supply ahead of competitors and may have stronger supplier relationships. On the most recent earnings call they even reiterated they have invested in additional DRAM supply.  Insider buying also caught my attention. Since the IPO  meaningful insider buying has been non-existent unless I'm missing something in the SEC EDGAR.  That changed for the first time with Thi La buying 50k shares at $6.10 and long term board member (Sam S.) bought 100k shares at $6.59. I've seen comments saying those amounts are small relative to their compensation  but who would finally put their own money into something they believe is headed off a cliff?  I have read the bear cases and many of them are valid. Post pandemic normalization is real and demand was clearly pulled forward. Customer service issues were not imaginary and Steve’s video deserved some popcorn to enjoy the show. Where I disagree is with the idea that RAM is just RAM and that memory is purely a commodity where anyone simply slaps their name on the product.  That is simply not true. There are different grades of memory  real binning complexity  frequency ceilings  latency tolerances  and validation differences. Yes  the fabs manufacture the wafers  but consistently pushing higher frequency  tighter timing modules at scale is not trivial. From our own binning experience  SK Hynix tends to offer the strongest overclocking headroom  Samsung typically follows  and Micron generally trails when pushed beyond stated specifications.  Based on that  I believe Corsair relies more heavily on SK Hynix for its higher performance kits. If Micron continues exiting the consumer segment  the impact on Corsair may be limited compared to many module suppliers that depend more heavily on Micron’s lower grade SpecTek chips  which are generally wafers that do not qualify for Micron branding.  Yes  the chart has been terrible for quite some time. Sentiment is weak  and I have already been wrong for years holding this. Truthfully  my first purchase was a spur of the moment driven decision  hoping to catch a ride. This time was different. It came after a significant amount of research and a deeper look at the fundamentals that led me to lean in again. After the earnings report  I had a clear opportunity to finally turn a five year loss into a profit on this ticker  and I did not sell. I held  and I plan to continue holding  because I see much more upside here than I believe the market is recognizing.  There is also the tariff situation. They absorbed about 12 million dollars.  The IEEPA tariffs were ruled on Friday to be illegal by the Supreme Court  though whether refunds materialize remains uncertain.  If it does result in a refund  that would be a giant offset to debt that's not being considered.  The final piece of my thinking was demand behavior. When a 2TB SSD is priced at $700+  most consumers cannot and should not justify that purchase like a business would. Discretionary spending does not disappear  it reallocates. If core components feel irrationally expensive  gamers will pivot toward other upgrades instead  whether that is a new case  keyboard  headset  mouse  or other peripherals. No  peripherals would not replace memory revenue dollar for dollar  but if elevated component pricing persists  revenue mix can shift in meaningful ways. Corsair has reported margins near 40% on those categories.  I am not presenting this as a clean turnaround story.  The setup has been messy and skepticism exists for a reason.  I could absolutely be wrong again. But sitting inside the same component ecosystem  this memory environment feels distorted in a way I have not experienced before  and Corsair appears to have positioned itself better than most other competitors.  In my opinion  their brand value is underestimated and the current price does not reflect that.  They finally have enough optimism in their own company to buy stock back  and are actually heading toward profitability.  That is why I added and held instead of taking the escape hatch when it finally appeared. Curious to hear what I am missing  or whether this becomes the very public and very expensive lesson I debated posting all along.  https://preview.redd.it/sh6oyn91r6lg1.png?width=1642&amp;format=png&amp;auto=webp&amp;s=7a8df1867f414750e40bfebedb5907813b294238,Eluktronics,138,127,1771824738,CRSR|TLDR|PC|AI|DRAM|SK|GB|TB|SKU|IPO|SEC|EDGAR|RAM|IEEPA|SSD,reddit
wallstreetbets,1rbw2z2,Google's CEO just sold nearly $10M of his own stock this week,*Sundar* *Pichai* *filed* *4* *separate* *sell* *transactions* *on* *Feb* *20th* *totalling* *\~$9.8M* *in* *$GOOGL* *stock.*    *-* *$4.4M* *sell*    *-* *$3.4M* *sell*    *-* *$1.6M* *sell*    *-* *$435K* *sell*    *All* *filed* *the* *same* *day* *via* *SEC* *Form* *4.* *Make* *of* *that* *what* *you* *will.*    *Anyone* *else* *watching* *insider* *filings* *lately?*    Like you all pointed out :   * scheduled **months earlier** * routine diversification or tax-related * NOT a sudden bearish signal,Nice-Dingo9138,616,202,1771790934,GOOGL|SEC,reddit
wallstreetbets,1rcn2y6,200k in $DOCN,https://preview.redd.it/zhao4kiiz9lg1.png?width=1410&amp;format=png&amp;auto=webp&amp;s=e8dbd5aa7a96698ddaf6cbc0fd8aaf1cf7293b35  added 30k today on today's dip  holding \~$200 000 of options in $DOCN  see you at Wendy's,asagi_lumina,9,28,1771866217,DOCN,reddit
wallstreetbets,1rblvp7,DOJ probes Netflix for potential anticompetitive leverage in $72B Warner Bros merger,Source: [https://finance.yahoo.com/news/doj-probes-netflix-power-over-233132671.html](https://finance.yahoo.com/news/doj-probes-netflix-power-over-233132671.html)  &gt;The Justice Department’s investigation of Netflix Inc.’s (NFLX) proposed $72 billion takeover of Warner Bros. Discovery Inc. (WBD) includes scrutiny of the streaming giant’s behavior and whether it wields anticompetitive leverage over creators in negotiations for acquiring programming.  &gt;The department is seeking to determine whether the deal “may substantially lessen competition or tend to create a monopoly in violation of Section 7 of the Clayton Act or Section 2 of the Sherman Act ” according to a copy of a civil investigative demand reviewed by Bloomberg News that was sent Friday. It went to an independent movie studio  according to people familiar with the matter.  &gt;The language in the demand  an administrative subpoena that hasn’t been previously reported  is the clearest sign yet that the Trump administration is going beyond a standard deal review as it investigates the merger  refuting an argument by Netflix in recent weeks that the government is not engaged in anything beyond the typical process.  &gt;The broad scope of the review is also a strong indication that it will take many more months before the government decides whether to challenge the Netflix-Warner Bros. deal in court — a delay that may benefit rival bidder Paramount Skydance Corp. (PSKY)  &gt;“Netflix operates in an extremely competitive market. Any claim that it is a monopolist  or seeking to monopolize  is unfounded ” Netflix Chief Legal Officer David Hyman said in a statement. “We neither hold monopoly power nor engage in exclusionary conduct and we’ll gladly cooperate  as we always do  with regulators on any concerns they may have.”  &gt;The application of both laws has precedent  and the investigation may not result in any federal action. But deal reviews are typically conducted by US antitrust enforcers using just the Clayton Act  which is specifically for merger investigations. The Sherman Act is a statute more typically used to target illegal monopolization by a single company such as Alphabet Inc.’s Google  Live Nation Entertainment Inc. and Visa Inc.  &gt;The DOJ is asking questions about Netflix’s ability to leverage its market power in negotiations with independent content creators such movie studios and filmmakers  according to the people. Netflix operates the largest paid video streaming service in the world and is one of the largest buyers of film and TV programming in the world.  &gt;Netflix is spending about $20 billion on programming this year  which is split between original series and licensed reruns. Many of its most popular original programs  including and are produced by third-party studios. In buying HBO and Warner Bros.  Netflix would acquire one of the largest studios as well as a major competitor in streaming.  &gt;The Wall Street Journal first reported that the DOJ’s review includes Netflix’s business practices and whether the deal would give the streaming giant monopoly power in the future.  &gt;“We have not been given any notice or seen any other sign that the DOJ is conducting a monopolization investigation ” Steve Sunshine  head of Skadden  Arps  Slate  Meagher &amp; Flom LLP’s global antitrust/competition group representing Netflix  said in a statement.  &gt;The Justice Department didn’t immediately respond to request for comment outside of normal business hours. Warner Bros. declined to comment.  &gt;Monopoly cases can require market concentration of more than 50%  a number that exceeds Netflix’s share with or without Warner Bros. Netflix accounts for about 9% of TV viewing in the US and a larger share of the streaming market  and its spending on programming is comparable to peers such as Disney and Comcast.  &gt;Warner Bros. earlier this week committed to resume talks with Paramount after a representative of the company indicated a willingness to raise its offer price by $1 per share to $31. Warner Bros. has given Paramount a deadline of Feb. 23 to submit its “best and final” offer.  &gt;Paramount  which launched a hostile bid for Warner Bros. last year  has repeatedly claimed that Netflix’s offer will never pass regulatory scrutiny in the US or Europe. Paramount also claimed Friday its tender offer has “no statutory impediment” for closing its $77.9 billion tender offer after clearing the DOJ’s second-request review process.  &gt;However  the offer could still be slowed down by an ongoing review in the EU  and US enforcers in the past have sued to block deals that they had initially waved through. Paramount could also face a gauntlet of US state attorneys general.,callsonreddit,1542,280,1771766963,DOJ|NFLX|WBD|PSKY|TV|HBO|LLP|EU,reddit
wallstreetbets,1rbqevz,India delays Washington trade visit as U.S. tariff policy shifts  source tells CNBC,,JKKIDD231,864,68,1771778210,CNBC,reddit
wallstreetbets,1rc0954,Korean market company sitting on half a B in cash,Found this company on the Korean market that’s valued a 60m but is sitting on half a billion in cash  look at the balance sheet   Ticker: 123420 Wemade Play  You cant’t make this shit up lmfao ,Timely-Dog8820,182,73,1771800531,,reddit
wallstreetbets,1rbxfcg,What Are Your Moves Tomorrow  February 23  2026,This post contains content not supported on old Reddit. [Click here to view the full post](https://sh.reddit.com/r/wallstreetbets/comments/1rbxfcg),wsbapp,179,7716,1771793853,,reddit
wallstreetbets,1rclbkl,I wish I knew where to ask...,I'm a boring ass value dude who has spent years being entertained by you all. I have a big brain question... Let's see what 1mm apes with keyboards do...     So  Mexico took out the leader of Jalisco Cartel. Mexicos tech hub is in Jalisco. In fact  Foxconns facility for Nvdias GB200 is in Guadalajara. There will be unrest due to a reorganization of the cartels in the area   a lot of terrible things are going to happen. a lot of business will be disrupted. Orders won't be filled... How do I use info like this to make money outside of predicting the easy stuff like these companies have a bad quarter due to unfilled orders?,JockeyFullaBourbon,6,34,1771862451,,reddit
wallstreetbets,1rc8xec,Options Auto-trading Bot?,Anybody Else got an Options Auto-trading Bot fully Functioning? Just backtested last 4 months  seems promising…,Less_Job_411,22,72,1771824537,,reddit
wallstreetbets,1razfm0,Iranian Rial has completely collapsed,,Sweaty_Rub4322,29240,1844,1771700499,,reddit
wallstreetbets,1rdbler,Back at peak,,Long_Tackle_6931,0,14,1771924934,,reddit
wallstreetbets,1rc7il3,SYSTERIX - YOLO $200k SPX Put Credit Spread (6645p / 6545p PCS due Feb 27  2026),[Position - 6645p \/ 6545p PCS due 2\/27](https://preview.redd.it/8uv9p2snl6lg1.jpg?width=1206&amp;format=pjpg&amp;auto=webp&amp;s=e60eea0b117e79a43e7dd34a74b5d65874713f3a)  Position - 6645p / 6545p PCS due 2/27  Looking to see how far I can trade this account before I blow it up - going to be posting my trades on a weekly basis.  Skew is STRONG and premiums are juicy this week. My internal models show me that there is good support at the 6646 area for SPX.  Have sold a put credit spread for 7.6 net credit (sold 20 contracts of 6645p and bought 20 of 6545p) - basically I'm risking $200k to make $15k if SPX remains above 6645 by the end of this week (Feb 27).  Let's see if I'll be buying a rolex at the end of the week? WISH ME LUCK!  **UPDATED POSITION (Feb 27):**  \[Will post updated screenshot once the week ends\],systerix,13,25,1771820177,TERIX|YOLO|SPX|PCS|TRONG|WISH|ME|LUCK|DATED|ITION,reddit
wallstreetbets,1rbrstt,Running this account to the mesosphere,If you aren’t participating in this generational run in PM miners what the fuck are you doing? ,TadpoleMysterious894,91,44,1771781344,PM,reddit
wallstreetbets,1rbyzgn,Since NYC is getting another big snowstorm tonight how will the market movers work? Are they going to have a virtual work-day in their PJs?,Genuine question btw,undiscoveredpain,39,17,1771797466,NYC,reddit
