subreddit,post_id,title,body,author,upvotes,number_of_comments,created_utc,ticker_symbols,source
ValueInvesting,1rd3q9t,15 investment write-ups to look at,15 write-ups from Substack published with the last week.  Not my work - sourced from Giles Capital's weekly compilation: [https://gilescapital.substack.com/](https://gilescapital.substack.com/)    # Americas  [**Guardian Research**](https://open.substack.com/users/47018375-guardian-research?utm_source=mentions) on [**GE HealthCare Technologies**](https://guardianresearch.substack.com/p/gehc-an-earnings-growth-masterclass) (🇺🇸 GEHC US - US$35bn)   Most classify this as a cyclical equipment maker  which couldn’t be further from where the business is heading. A mid-pivot into AI diagnostics and recurring software revenue  trading at 16x earnings while medtech peers command 29–37x  backed by a $21.8B order backlog and a credible path to $28–30B in sales by 2030.  [**Quipus Capital**](https://open.substack.com/users/18174823-quipus-capital?utm_source=mentions) on [**Suzano**](https://www.quipuscapital.com/p/suzano-pulp-and-paper-primer) (🇧🇷 SUZB3 SA - US$11bn)   Lowest-cost producer with 30% of the global hardwood pulp market. The Cerrado expansion is now ramping; the open question is how long Chinese overcapacity keeps prices suppressed before the cycle turns.  [**Value Don't Lie**](https://open.substack.com/users/5547617-value-dont-lie?utm_source=mentions) on [**Dauch Corporation**](https://www.valuedontlie.com/p/quick-value-305-dauch-corp-dch) (🇺🇸 DCH US - US$1.8bn) **TOP PICK**   Management owns 51% of a business trading at 4.4x EBITDA with $300M of identified cost cuts worth 17% of today’s market cap yet to be realised. The market is still digesting a complex industrial merger; the synergy upside makes the bar unusually low to clear.  [**Miroslav Štěpánek**](https://open.substack.com/users/94876173-miroslav-stepanek?utm_source=mentions) on [**Entravision Communications**](https://miroslavstepanek.substack.com/p/entravision-evc-eng) (🇺🇸 EVC US - US$130m)   6.8% dividend paid from a business sitting on roughly $380M of licensed broadcast airwaves. Two growing digital advertising platforms run alongside a declining legacy TV operation; the 2026 US midterm elections add a predictable revenue bump.  [**Tyler Moody**](https://open.substack.com/users/23728191-tyler-moody?utm_source=mentions) on [**Universal Electronics**](https://enterprisinginvestor.substack.com/p/universal-electronics-stock-analysis) (🇺🇸 UEIC US - US$56m)   The business trades below the value of its liquid assets - cash alone covers more than half the share price. Revenue has fallen sharply since 2019  but 28% gross margins and a pivot into smart home devices support the floor while the turnaround plays out.  # Europe  Middle East &amp; Africa  [**Daan | InvestInsights**](https://open.substack.com/users/193028862-daan-investinsights?utm_source=mentions) on [**L’Oréal**](https://rijnberkinvestinsights.substack.com/p/loreal-sa-a-beauty-empire-built-to) (🇫🇷 OR PA - €131bn)   €20B in revenue across 150+ countries  backed by a marketing budget 2–3x the size of its nearest rival. The compounding record speaks for itself; worth understanding the business model even if the entry point requires patience.  [**Daan | InvestInsights**](https://open.substack.com/users/193028862-daan-investinsights?utm_source=mentions) on [**Adyen**](https://rijnberkinvestinsights.substack.com/p/adyen-22x-fcf-for-a-best-in-class) (🇳🇱 ADYEN AS - €40bn)   Processed 837 million transactions on Black Friday alone with effectively no downtime. After a 27% post-earnings selloff  the stock trades at 22x free cash flow. The bull case rests on enterprise clients continuing to shift their payment infrastructure here  and on margins recovering as the growth investment cycle matures.  [**Emerging Value**](https://open.substack.com/users/39159640-emerging-value?utm_source=mentions) on [**Allegro.eu**](https://emergingvalue.substack.com/p/allegroeu-a-leading-platform-in-poland) (🇵🇱 ALE WSE - US$8bn)   Poland’s answer to Amazon  at 14x forward earnings. Sentiment sits near the floor after an €880M write-down on a shopping mall acquisition. The core Polish marketplace is growing steadily; financial services and advertising are barely started.  [**Iggy on Investing**](https://open.substack.com/users/129662952-iggy-on-investing?utm_source=mentions) on [**Global Dominion**](https://iggyoninvesting.substack.com/p/this-500m-company-will-generate-100m) (🇪🇸 DOM MC - €514m) **TOP PICK**   At 5x its 2027 free cash flow target  this trades at roughly a third of what comparable European service businesses command. The CEO and Chairman bought shares with their own money at Mahindra’s January block sale. Free cash flow goes from €25M today to €100M by 2027 as renewable energy assets are sold off and the capital-light service business takes over.  [**Under-Followed-Stocks**](https://open.substack.com/pub/underfollowedstocks) on [**Circle Group**](https://underfollowedstocks.substack.com/p/15-circle-group-spa) (🇮🇹 CIRC MI - €42m)   Software so deeply embedded in European port and customs operations that replacing it creates regulatory risk. IKEA is a client. Trading at 6.7x EBITDA with a 25% annual revenue growth track record since 2012  and the EU’s push to digitise logistics regulation still in early stages.  [**Etruscan Capital**](https://open.substack.com/pub/etruscancapital) on [**Macompta**](https://etruscancapital.substack.com/p/macompta-accounting-for-growth-in) (🇫🇷 MLMCA PA - €17m)   A simple idea with a good catalyst: France is making digital invoicing mandatory for small businesses  and Macompta is the cheapest and simplest platform to comply. €4M in revenue growing at 28%  solid margins  and a planned exchange uplisting in H2 2026 that most investors will miss.  # Asia-Pacific  [**Variant Perception Capital**](https://open.substack.com/pub/variantperceptions) on [**MediaTek**](https://variantperceptions.substack.com/p/mediatek-next-winner-powering-ai) (🇹🇼 2454 TW - US$55bn)   Two billion devices a year run on MediaTek chips - smartphones  televisions  tablets. As AI starts running on the device itself rather than in the cloud  the company’s position across the full hardware stack becomes considerably more valuable than the $19B revenue figure alone suggests.  [**Variant Perception Capital**](https://open.substack.com/users/263198408-variant-perception-capital?utm_source=mentions) on [**Japan Electronic Materials**](https://variantperceptions.substack.com/p/japan-electronic-materials-hidden) (🇯🇵 6855 TYO - US$420m)   Probe cards are what chipmakers use to test every semiconductor before it’s packaged - a small  highly technical component that cannot be skipped. With memory chip demand from AI data centres accelerating sharply  this company sits at a structural chokepoint. The stock has run 50%; the question is how far the earnings follow.  [**Variant Perception Capital**](https://open.substack.com/users/263198408-variant-perception-capital?utm_source=mentions) on [**Diffusion Engineers**](https://variantperceptions.substack.com/p/interesting-indian-microcaps-part-c3d) (🇮🇳 DIFFNKG NSE - US$120m)   Over 80% of revenue comes back from the same customers - not through contracts  but because wear-resistant parts for cement kilns and steel rollers are mission-critical and switching suppliers introduces real operational risk. New factory capacity funded from the IPO targets a near-doubling of revenue in 3–4 years.  [**Mr Deep-Value**](https://open.substack.com/users/113017890-mr-deep-value?utm_source=mentions) on [**Almetax Manufacturing**](https://www.mrdeepvalue.com/p/almetax-manufacturing-analysis) (🇯🇵 5928 TYO - US$28m)   Cash and liquid investments of ¥5.1B in a company with a ¥2.9B market cap. The business earns very little  but when liquid assets exceed the share price by that margin  the downside is well-defined. A classic Japanese balance sheet situation for those comfortable with operational marginalness.,Away_Definition5829,12,0,1771903855,GE|GEHC|AI|SA|DCH|TOP|PICK|BITDA|EVC|TV|UEIC|PA|ADYEN|AS|ALE|WSE|DOM|MC|CIRC|MI|IKEA|EU|MLMCA|TW|TYO|FFNKG|NSE|IPO,reddit
ValueInvesting,1rdbiwr,$HOOD  Focus on the structural credit risk,Most people are chasing the 24-hour market narrative  but the real forensic story is the November 2026 Credit Reset. HOOD is currently operating on a $2.25B Revolving Credit Facility that expires in less than 9 months. With a structural score of 6.8/10  the market is pricing in a Platform Monopoly  yet the SBC remains a predation vector—consuming over 40% of FCF. If the $71.42 support level fails  we’re looking at a liquidity-driven liquidation cascade toward the $52 zone.,SamLeCoyote_Fix_1,5,6,1771924669,HOOD|SBC|FCF,reddit
ValueInvesting,1rcxufg,Citrini Research claims AI will lead to severe economic downturn by 2028...C'mon,What a perfectly timed report  right in the middle of peak fear for AI disruption anxiety. This is my take on AI and the CapEx buildout:  \- As repeated in history  the computers were supposed to wipe out jobs  instead it created new jobs and millions of them.   \- Then the internet was going to eliminate jobs  instead it started new industries and created millions of them   \- The invention of the smartphone created an app ecosystem employing millions   \- AI will do the same. Jobs will be lost (like during times of the computer and Internet)  but many more will be created  same with industries.      \- We are so behind in the AI CapEx buildout  there is so much demand that it will take years to meet it. We need AI compute for (just to name a few): Healthcare and medical imaging  drug discovery  clinical documentation  software development and coding applications  enterprise automation  financial services (think fraud detection  etc.)  trading and investing algorithms  autonomous vehicles  robots  video generation and processing and there are literally a hundred more chomping at the bit for AI compute capacity. This is real  and the buildout has demand  so I don't want to hear any comments on overbuilding or the bubble  this is structural demand that the hyperscalers are chasing.   \- Many jobs can't be disrupted. An LLM can cut my hair  be my doctor  fix my car  plumb my sink  wire my lights  hospitality  a lot of jobs can't be disrupted  only optimized using  TADA AI computing capacity.   \- This massive investment cycle (early investment cycle) is creating jobs everywhere. Networking  infrastructure  construction  design  power  everywhere.   \- AI should drive down inflation and make things more manageable and affordable     \- The next 3-5 years will be an AI investment BOOM  after that  I really don't know  but please don't fall for these reports  they are timed perfectly to coincide with max fear.      \- Earnings are strong as hell  we are in a rate cut cycle  we stopped QT  and AI is driving GDP and productivity gains.   TLDR; watch out for the FUD reports as we near peak AI anxiety here in the market.   ,tdogger88,22,59,1771889663,AI|LLM|TADA|BOOM|QT|GDP|TLDR|FUD,reddit
ValueInvesting,1rdf1w4,Anti-AI marketing from Sass?,Sass companies like Salesforce and ServiceNow has been all in with AI narrative recently believing that their service and AI features are complementary. The market  on the other hand has not perceived it as complementary but an existential relationship  where Sass companies will be replaced by Ai-- It reminds me of a scene from the movie 'Aliens' where a alien embryo (Ai) gets planted inside a human host (Sass) growing by using their nutrients (Data) and later the erupts from it thus killing the host (Sass) in the process...  Question: When will Sass companies realize this and pivot by start questioning the utility of Ai to plant doubts into businesses in order to undermine (slow) Ai growth so that they can preserve their own existence? Or will they accept their fate and become a willing host because its too late.. the alien has already planted its embryo inside the host...?  A simple statement from Sass company like  '*We attempted to use Ai internally  but its not ready for prime time yet and for now we cannot recommend it to our customers.*..',squid_game_456,2,5,1771936480,AI,reddit
ValueInvesting,1rcm86e,Is the peak AI hype the beginning of a massive decline for the old enterprise software names?,I’m looking at:  * Accenture (ACN) * Adobe (ADBE) * Salesforce (CRM) * Oracle (ORCL) * ServiceNow (NOW) * Microsoft (MSFT)  And also:  * IBM * Intuit (INTU) * Snowflake (SNOW) * Autodesk (ADSK)  Most of them are down 30% or more in just a few weeks. Even MSFT is rolling over.  Yes  they had a huge run over the last two years. Valuations were stretched. You could argue it was a full bubble.  But now the selling is accelerating. Heavy volume. No real bounces. It feels different from a normal pullback.  So the question is simple:  Is AI structurally destroying the moat of these incumbents?     If AI reduces the need for consultants  implementation teams  layers of enterprise software… what happens to ACN? To CRM? To NOW?  If coding gets automated  what happens to ORCL  ADBE  ADSK?  If AI-native tools rebuild workflows from scratch  what happens to the whole legacy SaaS stack?  OpenAI and its CEO are destroying these stocks... and me along with them  haha.  ,Plus_Seesaw2023,69,138,1771864414,AI|ACN|ADBE|CRM|ORCL|MSFT|IBM|INTU|SNOW|ADSK,reddit
ValueInvesting,1rcml4y,PayPal Draws Takeover Interest  Bloomberg Reports.,https://www.bloomberg.com/news/articles/2026-02-23/paypal-attracts-takeover-interest-after-stock-slump?srnd=homepage-americas  Painpal Bagholders are saved? I have said at this valuation  the stock makes a lot of sense as a takeover target. I think they would make a lot of sense for high volume  low margin retailers like Walmart to buy them to reduce their processing fees  and as a cash flow engine  or for tech companies looking to get into the payments space.,skilliard7,67,86,1771865175,,reddit
ValueInvesting,1rdda68,Which metrics guide your stock-buying decisions?,Hi everyone   I’m curious about the metrics you rely on when deciding to buy a stock.  * Do you focus mainly on **valuation metrics** like P/E  P/B  EV/EBITDA? * Or do you prioritize **profitability and efficiency** metrics like ROE  ROA  margins  or free cash flow? * What about **growth metrics** — revenue growth  EPS growth  or market share expansion?,Adept_Mountain9532,2,20,1771931105,EV|BITDA|ROE|ROA|EPS,reddit
ValueInvesting,1rd86it,I randomly checked on google about TEAM software (Atlassian),Over 300 000 organizations worldwide  ranging from startups to major enterprises  use Atlassian products (Jira  Confluence  Trello  Bitbucket) for team collaboration and software development. Key users include major companies like Netflix  Spotify  LinkedIn  NASA  Visa  Twitter  Cisco  and Walmart Labs.   Key Industries and Companies Using Atlassian: spotify  Netflix  Reddit.  Aerospace &amp; Engineering: NASA  SpaceX  Northrop Grumman.  Finance &amp; Banking: Visa  Citigroup  Absa Group.  Retail &amp; Consumer Goods: Walmart Labs  ALDI  Coca-Cola.  Why you keep reading? Isn't AI gonna kill their business model.... lmao 🤣.,Hi_Keyboard_Warriors,5,6,1771912713,TEAM|NASA|ALDI|AI,reddit
ValueInvesting,1rcfucw,Novo Nordisk Trial Flop Ripples Through Denmark’s Stock Market - Bloomberg,TLDR: premarket -13.67%  Novo Nordisk Trial Flop Ripples Through Denmark’s Stock Market - Bloomberg  By Sanne Wass  February 23  2026 at 7:00 PM GMT+8  Disappointing data from Novo Nordisk A/S is sending shockwaves across equities in Denmark  dragging the wider market down and underscoring how tightly the country’s fortunes are tied to the obesity-drug maker.  The OMX Copenhagen 25 Index dropped as much as 3.6% Monday after Novo said its next-generation obesity treatment fell short of Eli Lilly &amp; Co.’s rival blockbuster in a trial. The Danish krone also weakened on the news  suggesting funds being pulled out of Denmark.  “Novo Nordisk’s downturn is creating negative spillover effects for other Danish stocks ” Per Hansen  investment economist at Nordnet said in note. “It is likely foreign investors who are collectively pulling out of Danish companies.”  While Novo tumbled as much as 17% on the news  the fallout spread across the market  with 21 of the Danish index’s 25 stocks trading lower. Fellow obesity-drug developer Zealand Pharma A/S was among the hardest hit.  The reaction by investors is “understandable ” given the number of negative announcements from Novo  Hansen said. The drugmaker is facing bruising competition from copycats and the relentless rise of US rival Lilly.  The troubles at Novo — which has warned of a steep decline in sales this year — have raised concerns about a broader economic slowdown in AAA rated Denmark  where the company has been a key growth engine in recent years. The drugmaker’s challenges have already dealt a blow to Danish consumer confidence and are weighing on Danish GDP growth.  https://www.bloomberg.com/news/articles/2026-02-23/novo-nordisk-trial-flop-ripples-through-denmark-s-stock-market,raytoei,97,65,1771848839,TLDR|PM|GMT|OMX|AAA|GDP,reddit
ValueInvesting,1rdew15,Semi conductors,I wanted to see which is better valued or will have more growth in the future MU or WDC I have WDC in my portfolio already but I was looking to switch to MU  so I came on here to ask do I buy MU or keep WDC or buy a little of both,Specific-Tomato2198,1,0,1771935996,MU|WDC,reddit
ValueInvesting,1rder94,1y beaten down sectors,I have had a look at beaten down sectors vs rest following the recent dips. Turns out the main ones are:  -private equity: -27% down from its peak in feb 2025. As comparison  sector was down -24% in 2022 and -43% during covid (vs ATH at that moment) -cybersecurity: -16% from ATH -SaaS: -32% vs ATH  see eg. IGV etf  Considering shifting some assets to Private equity sector  any smart as*s in the room who would not do that?  ,La_Menace_,0,1,1771935591,ATH|IGV,reddit
ValueInvesting,1rd7x3o,Boston Scientific (BSX) day 1 valuation,***Tldr***:this post is a rough calculation of the fair value of BSX. This is a day 1 valuation where i try to manually calculate the rough fair value of a stock. Day 2 valuation is done on the computer . Day 3 is a deeper dive into the business. I will provide the links in the comments  **Summary**:  A. Precovid they did about 12.4% growth between 2016 to 209. Post Covid they did around 17% from 2021 to 2025. Over the entire period they did around 11.8%  b. Management gave 2026 guidance as around 13.1% for adjusted eps and 10-11% for sales. ( i think this caused their sp to swoon recently)  C. Analysts are estimating between 13% to 20.93% growth in eps. I exclude the high end growth rate because it is either too optimistic or they are using the much lower GAAP eps where thy should be using the adjusted EPS.  D. In formulating the fair value of BSX  i need 2 key variables  what is the starting point and what is the growth (and for how long).  i use the 2025 adjusted EPS of 3.05 as the base. It is the nearest to the present  and since FCF/net income is above 80%  I deem it as an appropriate proxy for free cash flow ( see no.7)  I decided to work on two scenarios:  Scenario A:  13% eps growth for 5 years  Scenario B:  9% eps growth for 10 years  Inputting the values into the NPV calculator  I get a fair value of 79.97 to 88  E. Mstar has BSX a fair value of 90  Cfra has a fair value of 76.91  I concluded that at the current price  it is near the bottom end of the fair value price. If i were buying this  I would start buying with a 1/3 allocation.,raytoei,3,3,1771911848,BSX|GAAP|EPS|FCF|NPV,reddit
ValueInvesting,1rcciz6,I basically have a part time job just researching stocks. This can't be normal.,Okay so I take value investing seriously  which means I actually dig into a company before touching it.  But at the pace I'm going... it's unsustainable. Revenue trends  valuation multiples  competitor comparisons  management quality  growth runway. By the time I've gone through everything I care about I've burned a full evening on one company and I'm still second guessing myself.  I know some of you are tracking 20+ positions at once. How? Is there a smarter way to structure this or am I just doing it wrong? Do you use specific tools or has it just become muscle memory after years of doing it?  Right now my process feels like it's held together with browser tabs and stubbornness.,Particular_Wrap3787,128,65,1771837348,,reddit
ValueInvesting,1rcxqsh,Do you think long-term investing is harder psychologically than trading?,I’ve been thinking about this.  With trading  you get constant feedback — wins and losses happen quickly.  But with long-term investing  you might hold a stock for years while it underperforms or goes sideways.  For those here who focus on fundamentals  what do you find more challenging — patience or analysis?,rezovian,8,35,1771889421,,reddit
ValueInvesting,1rcsfxw,My Additions Today(My port is crying rn),I started the year off with a good performance  up 6.5%. My portfolio is now down 10 percent. I started investing in Oct 2025  in single stocks  so I know that now is the time to clench my cheeks and buy when the prices are good and portfolios are down.  Today I added to the following positions:  * **Fortinet**\- now 7.5% of portfolio                         CB: $79.22 per share * **Mastercard**\- now 10% of portfolio                    CB: $519.93 per share * **Fico**\- now 5.5% of portfolio                              CB: $1328.61 per share * **Intuit**\- now 1.5% of portfolio                             CB: $364.01 per share * **Brookfield Corp**\- now 2.41% of portfolio          CB: $45.32 per share  This is the updated allocation and cost basis after my buys.   I am a big fan of Fortinet over other cybersecurity plays due to its valuation  guidance  and management. It is founder led  they do buybacks  and with the expansion of AI  I see cybersecurity as a great industry to be in at the moment.  Mastercard I found to be at a good price below $550 per share. I continued to buy it as it fell and today I bought a ton at $495 per share  truly a gift lol. I think their growth and guidance are good  and I don't see any Ai disruption. There is the UK risk to consider but as of now MA in tandem with Visa still process 95% of card transactions there.   Fico has a really good moat   95% capitalization of their industry. I would love to buy it even cheaper. I bought in today at 1275ish but I don't plan on adding more unless I see a much larger drop.   Intuit is a small position for me  every time I think about buying and decide to wait  it drops another 10 percent haha. I bought some more today because once again I think the ai situation is overblown and we have yet to see an impact on their earnings. Should this drop to $325ish  I will add more.  BN has had really good guidance and in the last few weeks went up to $47+ per share. It had a dip today and I grabbed some. I'm just out of cash atp so I can't add more lol.  What are you guys adding today? :),Soggy-Ad147,15,10,1771877492,CB|AI|MA|BN,reddit
