subreddit,post_id,title,body,author,upvotes,number_of_comments,created_utc,ticker_symbols,source
Daytrading,1rcza33,Psychology and time on the charts is 95% of being profitable,I realized that if you can't even be psychologically ok to let mathematics play out then you will never make money trading. I literally have proof of this because I lived it. Experiences is also hugely important because I can tell you that I see the chart now and it's 100% different than 1 year ago  I know when price is good  I know when markets will range or move. It's literally a game of time  I can guarantee you will have better results if you follow structure and don't let anyone tell you that your strategy doesn't work. You need to decide that it doesn't work for you because it might work for someone else. You just have to know the 5% which is chart basics and the rest is experience in the market.,F1TFO,1,2,1771892918,,reddit
Daytrading,1rcz1pq,How would you start if you knew what you knew now,Hello everyone   I’m a college student with some free time and I’m interested in learning day trading. I’m starting from the beginner level and wanted to ask: if you were starting over today  what resources or steps would you focus on first to actually understand the markets (not just gamble)? Books  courses  YouTube channels  or strategies you’d recommend would be really helpful. Thanks in advance. ,Turbulent-Rest-8403,1,1,1771892476,,reddit
Daytrading,1rcgmf6,Trading whilst working a Full-time Job as a delivery driver?,Hey guys  I need some advice and a diff perspective. So currently  I'm in a sticky situation in my life where I have some debts to pay off which will take me a few months to pay off.  As a result  I don't have enough capital to trade with atm and I can't be in the markets until those debts are cleared  however  I have a winning short-term trading strategy that I've tested over time  so it's just a matter of building back up the capital.  Due to my circumstances  I need to find full-time work in order to support myself and have extra capital to trade with  and I'm thinking of doing Parcel driver delivery jobs (such as DPD).  My though process is that because it's just me in the van all day. I will have the ability to quickly stop  manage and enter positions  which should only take a few mins to do  as I got along my parcel routes.  I'm usually only trading 4-6 per month/1-3 trades per week  so I don't have to obsessively be in the markets everyday during the week  like a day trader would be.      To anybody that is/has been in a similair position  or for anybody that may some solid perspectives regarding this matter  what do you guys think about this?  Any response is much appreciated!     ,CombinationNumerous8,9,15,1771851188,DPD,reddit
pennystocks,1rd6ukn,The Lounge,Talk about your daily plays  ideas and strategies that do not warrant an actual post.   This is the place to request buy/sell advice from the community.   Remember to keep it civil.  Trade responsibly.,AutoModerator,18,90,1771909280,,reddit
pennystocks,1rdexlv,🚨 The Asian markets are officially awake. Keep your eyes on $QH today. 🇨🇳📈,Listen up  the setup on Quhuo Limited ($QH) right now is a ticking time bomb  and here is exactly why you need it on your watchlist today:  1. The Holiday is Over (The Catalyst): The Chinese markets have been closed for a massive holiday. While they were gone  the volume completely dried up and shorts had a field day playing games in an empty room. As of today  the Asian money is officially back online and the liquidity vacuum is about to get filled.  2. The Technical "Coiled Spring": Here is the only technical thing you need to know—the volume has been so dead lately that the price has compressed right at the absolute bottom support  creating a coiled spring. Because the order book is completely empty above us (zero liquidity)  there is almost no resistance. The second real volume steps in  this thing is going to snap upwards violently because there are simply no sellers left in the way to stop it.  3. Shorts Got Greedy: They pushed the price down on literal air. Now that the market is waking up  any sudden spike is going to trigger panic covering.  Don't sleep on this. Once the momentum scanners pick up the initial volume  retail is going to flood in. 🚀  (Not financial advice  just my play for the week. Let's get it!),Current-Programmer10,0,1,1771936123,QH,reddit
pennystocks,1rdaqta,$AIRE Quietly Sitting at a Make or Break Level,  Been watching **$AIRE** and it’s now sitting right at a level where things usually decide direction.  Price has bled into a **strong demand/support zone** while momentum indicators are getting stretched. RSI is hovering around oversold territory  which doesn’t guarantee a bounce  but historically this is where sellers start running out of steam.  # Why AIRE is interesting fundamentally  They’re building **AI powered platforms for real estate transactions**:  * Home search tools * Mortgage matching * Automated paperwork/workflows * End-to-end transaction ecosystem  Basically trying to simplify the messy home buying process using AI.  # Macro tailwind angle  If rate cuts actually roll in this year:  Lower mortgage rates  more housing activity  more demand for platforms that streamline transactions.  AIRE sits directly in that pipeline.  # What I’m watching technically  If buyers step in at this demand:  Potential upside areas:  * $0.40 first reclaim * $0.55 momentum zone * $0.64 resistance test * $1.00 if sentiment flips hard  https://preview.redd.it/1w5vyy0qkelg1.png?width=1617&amp;format=png&amp;auto=webp&amp;s=1cb98eca63e4fea7d393652df1d4fc20a0e3b681  Right now it’s less about hype and more about **risk/reward being defined ** support is clear  invalidation is clear.  Still a small cap so volatility is guaranteed  but setups like this are usually where moves *start*  not where they end.  Curious if anyone else is tracking AIRE or the AI + housing angle in general.,kur0mi_mel0dy,2,3,1771921640,AIRE|RSI|AI,reddit
pennystocks,1rclbf5,Dow leads market selloff as Trump shifts gears on tariffs - what this means for penny stocks,Markets sold off after President Trump signaled a new escalation on tariffs  sending the **Dow Jones Industrial Average** lower and dragging the **S&amp;P 500** and **Nasdaq Composite** with it. The renewed trade tension rattled investors and triggered a broad risk-off move across equities.  Bond yields pulled back as money rotated into safer assets  while higher-beta names took the hardest hit.  **Why this matters for penny stocks:**  • When macro uncertainty spikes  small caps and low-float names usually feel it first   • Liquidity dries up fast in risk-off sessions   • Volatility increases both ways - sharp dumps but also sharp bounce setups   • Traders rotate out of speculative plays and into defensive positioning  Penny stocks thrive on momentum and liquidity. When headlines like tariffs dominate  that liquidity can disappear quickly. But panic selling can also create oversold opportunities for disciplined entries.  Are you sitting in cash  cutting risk  or watching for dip setups?   What tickers are holding up despite the macro pressure?  Let’s discuss.,LesBattersby17,36,5,1771862444,,reddit
pennystocks,1rd0pki,$RCKT: IMO Approval odds at 70‑80% and why this one could even see early clearance,We have a near‑term catalyst for RCKT: the resubmission of the Kresladi (marnetegragene autotemcel) BLA; A gene therapy for severe Leukocyte Adhesion Deficiency‑I (LAD‑I) was accepted by the FDA back in October 2025  and a PDUFA action date of March 28  2026 is set for the decision.   ￼  This isn’t a fresh application; Rocket already went through a full review once and met all the clinical endpoints and safety outcomes in the Phase 1/2 trial. The original submission demonstrated 100% overall survival at 12 months post‑infusion  strong reductions in serious infections  and a favorable safety profile  which is as strong of a clinical dataset as you can reasonably ask for in an ultra‑rare disease.  ￼  The CRL context:  The FDA did issue a Complete Response Letter (CRL) back in June 2024 but it wasn’t about the underlying science or efficacy. The CRL asked for limited additional information regarding Chemistry  Manufacturing  and Controls (CMC) to ensure a robust  reproducible production process. That’s operational  not clinical. CMC-related CRLs are very common and generally fixable without generating new clinical data.  ￼  When you compare this to more serious CRLs; like those that fail to meet primary endpoints  this one falls into the “manageable” bucket. The agency doesn’t have unanswered questions about whether the drug works or is safe; they have questions about how it’s documented in manufacturing and process controls  which Rocket has already addressed in its resubmission.  Given that  this isn’t the typical risky CRL where the FDA says  “come back with new clinical data.” Rocket’s interaction with the FDA suggests alignment and a pathway that’s substantially cleared of the biggest hurdles.  Why I’m assigning 70‑80% odds (and why early approval is even possible):  •	The FDA has accepted the resubmission and formally started the review clock. Acceptance means the submission is administratively complete and valid for full review.  ￼  •	All the heavy science: the efficacy and safety was already demonstrated in the Phase 1/2 data. That lowers the biggest unknown.  ￼  •	CMC issues are typically resolved with documentation and follow‑ups  not new clinical trials. That pushes this toward a more procedural review than a substantive one.  •	If the FDA finds nothing outstanding in the CMC material  meaning no additional questions the final decision could slip in earlier than the formal PDUFA date.  Price action and options activity:  Over the last couple of weeks  the stock has been creeping up from the low‑$3 area as we move closer to the March 28 PDUFA date. That pattern makes sense: the market is pricing in a possible approval and the reduction of binary risk. That’s broadly recognized as a positive directional signal in regulatory catalysts  stocks tend to move toward the main event when participants have conviction that the risk is priced appropriately.  If you look at the option chains  there’s significant high‑value open interest in the April expiries. (First available option post pdufa date) Traders are positioning with a bias toward an approval outcome  not just casual speculative positioning. This isn’t a handful of tiny contracts; these are serious trades with meaningful notional exposure  which suggests confidence in a positive endpoint.  Product story matters too:  The therapy targets a condition  severe LAD‑I  where traditional treatment options are extremely limited and often not successful. Rocket’s gene therapy  if approved  would not only address a clear unmet need but also make the company eligible for a Rare Pediatric Disease Priority Review Voucher (PRV)  which has material economic value.  ￼  None of this is investment advice there are always risks  and approvals are never guaranteed but when you line up:  •	Already proven efficacy and safety  •	Operational CRL vs. scientific CRL  •	Positive stock movement into the event  •	Meaningful options positioning  •	Near‑term clear date  So 70 to 80% feels like a grounded  evidence‑based probability to me. If you follow any of my other posts  I am a regulatory professional myself. I am on the medical device side though  but have been personally through many submissions with the FDA. I do understand their general thinking process I will never sign 100% possibility of course and probably 80 is the highest I will ever give)  This is why I’m comfortable putting odds there and why I think there’s even a credible path to early approval before March 28 if the FDA has no lingering questions.,Scquwer,5,8,1771896322,RCKT|IMO|BLA|LAD|FDA|PDUFA|CRL|CMC|PRV,reddit
pennystocks,1rcyy3v,$GIPR $3M MC with $100M in assets and just raised $11M in cash..,GIPR looks very undervalued and today had some great news come out in after hours: They sold some assets and retired debt. Now the company has almost 4X their entire MC in cash alone with 100m+ in total assets. This is one of the most undervalued stocks I have seen and they have no dilution available. Potential buy out candidate or acquisition coming now they have a strong cash position.     Next key levels to break are .75/.84 for continuation in pre market. ,ImN0tYourGuy_tv,7,7,1771892264,GIPR|MC,reddit
pennystocks,1rc785w,$MSS Setting Up For Real Bullish Momentum,**$MSS** is the second one I wanted to take a look at and a lot of you probably have it on your radar as well.  For some background  they have a **\~6M float.** They are currently non-compliant **for bid-price minimum** but the **deadline is still four months out**. I don’t see any toxic financing in the filings. They appear to have been **beaten down severely after an RS vote.** I’ve seen it stated that the RS damage is already baked in and at a glance I agree. I also agree that it looks like it has bottomed and appears to be reversing. I have no position yet. Now  to the charts.   I took a look at the **1Min/1D  5Min/5D  15Min/20D.** Throwing a wide net with **9  10  50  100  &amp; 200 EMA’s.** Threw in **RSI and MACD oscillators.** A couple of things immediately jump out at me.  It’s subjective but **on the minute chart** you can see a **bull flag fairly clearly**. Specifically  you see a clear impulse **upward to the $.33’s**  **followed by a flat shelf of small candles near the highs.** To me this reads like buyers absorbing supply without giving up much ground.  After that shelf  see how the **price flushes but then snaps right back up**? That reads to me like lower prices are getting rejected. ***Dips get bought.***  If you check out the EMA’s/VWAP they also support the Bull Flag interpretation. VWAP holds at $.3276 and the EMA’s are just below.    **The 5Min chart reenforces the bullish context.** See those tall green candles on the right side pushing the price clear of all the chop? **That suggests range expansion** to me.  ***And range expands upward after a base  it doesn’t grind back down.*** After that you can see it hold and continue pushing with higher swing structure into the $.33’s. And even though it’s just under VWAP  **the price stays elevated well above the deeper EMA stack.** So this tells us again  **pullbacks are being supported.**  **MACD is positive and rising. RSI is strong.** I’d actually like to see it a little weaker but that’s just me.    **On the 15M chart** you can kind of see an **ascending triangle forming**. See all those **higher lows moving up to resistance?** Buy volume was defending those higher lows until they tested the top at around $.34. What I like seeing even more with this zoomed out view is this **multi-session compression/expansion pattern.** You can’t get a textbook candlestick pattern from this but it indicates a bullish bias that is actually more reliable than candlestick patterns and fails less often.  \_\_\_\_\_\_\_\_\_\_\_\_\_\_\_\_\_\_\_\_\_\_\_\_\_\_\_\_\_\_\_\_\_\_\_\_\_\_\_\_\_\_\_\_\_\_\_\_\_\_\_\_\_\_\_\_\_\_\_\_\_\_\_\_\_\_\_\_\_\_\_\_\_\_\_\_\_\_\_\_\_\_\_\_\_\_\_\_\_\_\_\_\_\_\_\_\_  **So in summary ** it’s apparent that $MSS is going to do… something. I feel that **the following technicals support the thesis that it is going to do something bullish:**  On 1m  the move formed a flag-like shelf near the highs rather than an immediate dump. This suggests continuation   MSS is showing range expansion to the upside on the 5m/15m after compressing around the 0.30–0.31 area  with a recent push into the 0.34’s.  Pullbacks are being bought above the deeper EMA cluster.  Momentum is supportive on 5m/15m  posting positive MACD and  RSI in the 70s.     The charts point to more upward momentum IMO  probably soon. I can’t say whether it will be a sustained run or it will be a quick up and down. But I can say that **the charts indicate that a real bottom reversal is in process here.** I can’t say whether it will be a a super-mega-run like we’ve been seeing in pennies lately. But I can say a breakout with respectable volume could easily deliver 50% or more  and I can also say that no matter how strong it might look  **I will be taking some profit at 30% and raising my stops.** YMMV. That’s assuming I can even scale in before it does whatever it’s setting up for.    Here are some levels I’m using if it helps:  **\~$.335 break is my trigger** to buy for a breakout.  **Support is \~$.305.** **My line in the sand is $.295 breakdown with volume  three consecutive one minute candles (bodies).**,river_miles,61,10,1771819298,MSS|RS|EMA|RSI|MACD|VWAP|IMO|YMMV,reddit
pennystocks,1rcfg97,SGN merger run explained,Below is a screenshot of the run SGN is going on right now because of the anticipation for the merger together with timestamps for all the merger news as they happened.   It's a sell the news event for me.       The X float above each day means how many times the entire float was traded each day and the DVL is how much dollar volume was traded each day.      Using float rotation and $DVL is the best way I know to understand how thin something is and how much participation there actually is in a name. It's how you know if something is exhausting or just getting started.  The vote is 3/13  Let me know if y'all have any questions   https://preview.redd.it/h75l4zedg8lg1.png?width=959&amp;format=png&amp;auto=webp&amp;s=8f00e72eb73c3311212ea4ed824a06620ac1e337  ,fastmoshe,7,21,1771847622,SGN|DVL,reddit
pennystocks,1rc8erw,The Lounge,Talk about your daily plays  ideas and strategies that do not warrant an actual post.   This is the place to request buy/sell advice from the community.   Remember to keep it civil.  Trade responsibly.,AutoModerator,25,713,1771822925,,reddit
pennystocks,1rcseaa,HYPD vs GOTV: Both caught my attention  both stopped talking. What gives?,Been going through my watchlist and noticed something funny. Two names I've been following have gone completely silent.  First is HYPD. Last news drop was February 4th about that partnership and the volatility vault thing. Interesting concept on paper  especially with the timing. But that was almost three weeks ago now. No updates since then. No follow-up on whether the vault is actually running or what kind of traction they're seeing. Just radio silence.  Not saying that's a red flag necessarily. Sometimes companies just execute without blasting out press releases every week. But for a small cap that needs catalysts to move  the quiet periods can feel like forever.  The other one is FullPAC. They're the campaign tech company trying to go public under the ticker GOTV. They've been running a Reg A offering at $5 a share ahead of their planned Nasdaq listing. But since that January 8th announcement about the Govt.com launch  not much new either.  With FullPAC it's a little different since they're still in pre-IPO mode. But still  you'd think they'd want to keep some buzz going if they're trying to attract investors before listing.  Just find it interesting how both landed on my radar  both had announcements that caught my attention  and now both are in this holding pattern.  Could mean nothing. Could mean they're both quietly working. Could mean the hype was overblown. Hard to tell from the outside.  Mostly just posting to see if anyone else is still watching either of these. Found anything I missed? Any whispers on what HYPD is actually doing with that vault? Anyone buy into the GOTV offering and hear anything since?  Disclaimer - This is not financial advice  please do your own research -[ 1](https://finance.yahoo.com/quote/HYPD/?_guc_consent_skip=1767653414) [ 2](https://ir.eyenovia.com/) [ 3](https://chartingdaily.com/creative-design-platform)  [4](https://gotv.com/)  [5](https://chartingdaily.com/creative-design-platform),Personal_Pride_2238,1,1,1771877393,HYPD|GOTV|PAC|IPO,reddit
pennystocks,1rcqe1a,Chile’s Choquelimpie – A Junior Miner With Muscle,Norsemont Mining is quietly advancing its 100% owned Choquelimpie gold silver copper project. This past producing site features proven resources and an existing mill  rare for OTC juniors.  ⛏️Why it stands out:  • 2.18M oz AuEq Indicated + 557k oz Inferred  • Large open-pit style resource with expansion potential  • Fully funded Phase 3 drilling into high grade zones  • Located in a top tier mining jurisdiction  Gold markets are hot  and projects like this move fast when drill results hit.,One-Dingo1220,1,1,1771873134,OTC,reddit
pennystocks,1rcj2p5,#AIMD - Ainos Activates Industrial-Scale Deployment Roadmap of Up to 20 000 Units,Ainos ($AIMD) today announced the activation of a phased industrial deployment roadmap under a strategic framework that contemplates the installation of up to 20 000 AI Nose units within semiconductor manufacturing environments.  **Phased Expansion Framework within Back-end Semiconductor Environments**  The framework under a Memorandum of Understanding with ASE Technology Holding Co.  Ltd. ("ASEH") outlines a multi-phase expansion strategy designed to integrate digital olfaction  powered by the AI Nose platform  into ASEH's semiconductor packaging and testing facilities.  Ainos is executing the first phase of deployment that includes:  * confirmed order of 1 400 AI Nose units under a three-year subscription structure totaling approximately $2.1 million * Ainos has received $350 000 in customer deposit payments * Ainos is targeting to complete the first phase deployment by the end of Q2 2026.  Following phase one:  * Phase two contemplates deployment of 5 000 AI Nose units * Phase three contemplates deployment of up to 15 000 AI Nose units  Advancement into subsequent phases remains subject to milestone validation and contractual progression under the strategic framework.  **Expansion into Advanced Front-End Semiconductor Fabs**  In parallel  Ainos is deploying AI Nose within advanced front-end semiconductor wafer fabrication facilities for validation testing. These deployments are part of technical qualification and remain subject to customer review and formal commercial approval prior to potential conversion into revenue-generating programs.  "Industrial AI is evolving toward multi-sensory infrastructure " said Eddy Tsai  Chairman  President and CEO of Ainos. "I believe digital olfaction represents a missing intelligence layer inside automated environments. We are executing a disciplined roadmap to integrate scent intelligence into semiconductor operations through scalable  recurring deployment models.",New_Daikon4759,2,1,1771857322,AIMD|AI|ASE|ASEH,reddit
pennystocks,1rcnfqg,Maritime Launch ($MAXQ),MDA invested $10 million in Maritime Launch and became an equity owner because they want to help develop and support real launch operations at Spaceport Nova Scotia.   At the same time  Canada’s defence and industrial strategy now clearly highlights satellites  space-based intelligence  and space launch as key sovereign capabilities the country needs to build. So you’ve got government policy saying Canada must launch from its own soil  and major space investors and companies putting money into the one launch site being built to do it. ,Desperate-Ring12,1,1,1771866945,MAXQ|MDA,reddit
pennystocks,1rcms3x,IF YOU ARE SUFFERING FROM MOOD SWINGS   HERE'S A GOOD PHARMA FOR YOU (VANDA),The massive +52.08% surge in Vanda Pharmaceuticals Inc. (NASDAQ: VNDA) today (February 23  2026)  pushing the stock to around $8.76 (with intraday highs in the $8–$9 range and volume exploding to \~18–30M+ shares vs. average \~2M)  was driven by a major positive catalyst: FDA approval of its new drug BYSANTI™ (milsaperidone).  Announced late last week (February 20  2026)  the U.S. FDA approved BYSANTI (milsaperidone) tablets as a **first-line therapy** for:  * Acute treatment of **manic or mixed episodes** associated with **bipolar I disorder** in adults. * Treatment of **schizophrenia** in adults.  https://preview.redd.it/asrwo5znx9lg1.png?width=1388&amp;format=png&amp;auto=webp&amp;s=3365c5957123401955a749339125a8a016692361  ,Any_Pomegranate1134,1,1,1771865592,IF|YOU|ARE|ERING|FROM|MOOD|WINGS|HERE|GOOD|HARMA|VANDA|ASDAQ|VNDA|FDA|SANTI,reddit
