subreddit,post_id,title,body,author,upvotes,number_of_comments,created_utc,ticker_symbols,source
investing,1rbemgy,Best way to start investment account for adult son?,I was too poor to be able to save up for my son's college  but now that I'm doing a little better  financially I want to try to help him.  He's a legal adult now and in college  using student loans.  I figure I can set aside some money each month and put it into some kind of investment account  then several years down the line after he graduates I can give it to him to pay off his student loans.  What I'm wondering is if there's any special kind of account for this kind of thing?  Something that maybe has a tax advantage of some kind?  If not  I guess I'll just open a normal brokerage account and use that. But I thought I'd ask first.,titsdown,5,8,1771742042,,reddit
options,1r0a7ro,Options Questions Safe Haven periodic megathread | February 9 2026,We *call* this the weekly Safe Haven thread  but it might stay up for more than a week.  For the options questions you wanted to ask  but were afraid to.   **There are no stupid questions.**  &amp;nbsp;  **Fire away.**   This project succeeds via thoughtful sharing of knowledge.   **You  too  are invited to respond to these questions.**   This is a weekly rotation with past threads linked below.  ----  ###**BEFORE POSTING   PLEASE REVIEW THE BELOW LIST OF FREQUENT ANSWERS.**   [.](https://www.reddit.com/r/options/wiki/faq/subreddit_resources)     [..](https://www.reddit.com/r/optionsmods/wiki/)     ---  **As a general rule: "NEVER" EXERCISE YOUR LONG CALL!**    A common beginner's mistake stems from the belief that exercising is the only way to realize a gain on a long call. It is not. Sell to close is the best way to realize a gain  almost always.        **Exercising throws away [extrinsic value](https://www.reddit.com/r/options/wiki/faq/pages/extrinsic_value) that selling retrieves.**    **Simply sell your (long) options  to close the position  to harvest value  for a gain or loss.**   **Your break-even is the cost of your option when you are selling.**   **If exercising (a call)  your breakeven is the strike price plus the debit cost to enter the position.**   Further reading:    **[Monday School: Exercise and Expiration are not what you think they are.](https://www.reddit.com/r/options/comments/m5r8mi/monday_school_exercise_and_expiration_are_not/)**      **As another general rule  don't hold option trades through expiration.**  Expiration introduces complex risks that can catch you by surprise. Here is just one [horror story](https://www.reddit.com/r/options/comments/ipqkua/fridays_tsla_lesson_close_positions_before/) of an expiration surprise that could have been avoided if the trade had been closed before expiration.  ---  **Key informational links**   •&amp;nbsp;[Options FAQ / Wiki: Frequent Answers to Questions](https://www.reddit.com/r/options/wiki/faq)   •&amp;nbsp;[Options Toolbox Links / Wiki](https://www.reddit.com/r/options/wiki/toolbox/links)   •&amp;nbsp;[Options Glossary](https://www.optionseducation.org/referencelibrary/optionsglossary)    •&amp;nbsp;[List of Recommended Options Books](https://www.reddit.com/r/options/comments/8qfs14/options_book_list_review_of_all_books_that_helped/)     •&amp;nbsp;[Introduction to Options (The Options Playbook)](https://www.optionsplaybook.com/options-introduction/)   •&amp;nbsp;[The complete r/options side-bar informational links (made visible for mobile app users.)](https://www.reddit.com/r/options/about/sidebar)   •&amp;nbsp;[Characteristics and Risks of Standardized Options (Options Clearing Corporation)]( https://www.theocc.com/about/publications/character-risks.jsp)   •&amp;nbsp;[Binary options and Fraud (Securities Exchange Commission)](https://www.sec.gov/files/ia_binary.pdf)    [.](https://www.reddit.com/r/options/wiki/faq/subreddit_resources)   ----  **Getting started in options**    •&amp;nbsp;[Calls and puts  long and short  an introduction (Redtexture)](https://www.reddit.com/r/options/wiki/faq/pages/basics)      •&amp;nbsp;[Options Trading Introduction for Beginners (Investing Fuse)](https://investingfuse.com/options-trading-for-beginners/)     •&amp;nbsp;[Options Basics (begals)](https://www.reddit.com/r/options/comments/gh9vpl/options_basics/)   •&amp;nbsp;[Exercise &amp; Assignment - A Guide (ScottishTrader)](https://www.reddit.com/r/options/wiki/faq/pages/exercise)   •&amp;nbsp;[Why Options Are Rarely Exercised - Chris Butler - Project Option (18 minutes)](https://www.youtube.com/watch?v=PsZsqiBFnmo)   •&amp;nbsp;[I just made (or lost) $___. Should I close the trade? (Redtexture)](https://www.reddit.com/r/options/comments/eunnko/noob_safe_haven_thread_jan_27_feb_02_2020/fg6jjjz/)     •&amp;nbsp;[Disclose option position details  for a useful response](https://www.reddit.com/r/options/wiki/faq/pages/trade_details)   •&amp;nbsp;[OptionAlpha Trading and Options Handbook](https://optionalpha.com/handbook)    •&amp;nbsp;[Options Trading Concepts -- Mike &amp; His White Board (TastyTrade)(about 120  10-minute episodes)](https://www.youtube.com/playlist?list=PLPVve34yolHY43YaBegHMzN9WjrTnQfFr)   •&amp;nbsp;[Am I a Pattern Day Trader? Know the Day-Trading Margin Requirements (FINRA)](https://www.finra.org/investors/learn-to-invest/advanced-investing/day-trading-margin-requirements-know-rules)    •&amp;nbsp;[How To Avoid Becoming a Pattern Day Trader  (Founders Guide)](https://foundersguide.com/pattern-day-trader/)      ---  **Introductory Trading Commentary**    &amp;nbsp;&amp;nbsp;&amp;nbsp;•&amp;nbsp;**[Monday School Introductory trade planning advice (PapaCharlie9)](https://www.reddit.com/r/options/wiki/faq/pages/mondayschool)**   &amp;nbsp;&amp;nbsp;**Strike Price**    &amp;nbsp;&amp;nbsp;&amp;nbsp;•&amp;nbsp;[Options Basics: How to Pick the Right Strike Price (Elvis Picardo - Investopedia)](https://www.investopedia.com/articles/active-trading/021014/options-basics-how-pick-right-strike-price.asp)   &amp;nbsp;&amp;nbsp;&amp;nbsp;•&amp;nbsp;[High Probability Options Trading Defined (Kirk DuPlessis  Option Alpha)](https://www.youtube.com/watch?v=DcWHh2co80M)    &amp;nbsp;&amp;nbsp;**Breakeven**   &amp;nbsp;&amp;nbsp;&amp;nbsp;•&amp;nbsp;[Your break-even (at expiration) isn't as important as you think it is (PapaCharlie9)](https://www.reddit.com/r/options/comments/m0m7at/monday_school_your_breakeven_isnt_as_important_as/)   &amp;nbsp;&amp;nbsp;**Expiration**   &amp;nbsp;&amp;nbsp;&amp;nbsp;•&amp;nbsp;[Options Expiration &amp; Assignment (Option Alpha)](https://www.youtube.com/watch?v=OnUsu1y1W9w)     &amp;nbsp;&amp;nbsp;&amp;nbsp;•&amp;nbsp;[Expiration times and dates (Investopedia)](https://www.investopedia.com/terms/e/expiration-time.asp)   &amp;nbsp;&amp;nbsp;**Greeks**   &amp;nbsp;&amp;nbsp;&amp;nbsp;•&amp;nbsp;[Options Pricing &amp; The Greeks (Option Alpha) (30 minutes)](https://www.youtube.com/watch?v=kCJcEOYuuII)   &amp;nbsp;&amp;nbsp;&amp;nbsp;•&amp;nbsp;[Options Greeks (captut)](https://www.reddit.com/r/options/comments/hl8i2n/option_greeks_101)   &amp;nbsp;&amp;nbsp;**Trading and Strategy**     &amp;nbsp;&amp;nbsp;&amp;nbsp;•&amp;nbsp;[Fishing for a price: price discovery and orders](https://www.reddit.com/r/options/wiki/faq/pages/introduction#wiki_minimizing_bid-ask_spreads_.28high-volume_options_are_best.29)      &amp;nbsp;&amp;nbsp;&amp;nbsp;•&amp;nbsp;[Common mistakes and useful advice for new options traders (wiki)](https://www.reddit.com/r/options/wiki/faq/pages/introduction#wiki_common_mistakes_and_useful_advice_for__new_options_traders)   &amp;nbsp;&amp;nbsp;&amp;nbsp;•&amp;nbsp;[Common Intra-Day Stock Market Patterns - (Cory Mitchell - The Balance)](https://www.thebalance.com/common-intra-day-stock-market-patterns-1031456)     &amp;nbsp;&amp;nbsp;&amp;nbsp;•&amp;nbsp;[The three best options strategies for earnings reports (Option Alpha)](https://optionalpha.com/blog/the-three-best-option-strategies-for-earnings)     ---  **Managing Trades**   •&amp;nbsp;[Managing long calls - a summary (Redtexture)](https://www.reddit.com/r/options/wiki/faq/pages/managing_long_calls)   •&amp;nbsp;[The diagonal call calendar spread  misnamed as the "poor man's covered call" (Redtexture)](https://www.reddit.com/r/options/wiki/faq/pages/diagonal_calendars)   •&amp;nbsp;[Selected Option Positions and Trade Management (Wiki)](https://www.reddit.com/r/options/wiki/faq/pages/positions)    **Why did my options lose value when the stock price moved  favorably?**   •&amp;nbsp;[Options extrinsic and intrinsic value  an introduction (Redtexture)](https://www.reddit.com/r/options/wiki/faq/pages/extrinsic_value)        **Trade planning  risk reduction  trade size  probability and luck**   •&amp;nbsp;[Exit-first trade planning  and a risk-reduction checklist (Redtexture)](https://www.reddit.com/r/options/wiki/faq/pages/trade_planning)   •&amp;nbsp;[Monday School: A trade plan is more important than you think it is (PapaCharlie9)](https://www.reddit.com/r/options/comments/mpk6yf/monday_school_a_trade_plan_is_more_important_than/)   •&amp;nbsp;[Applying Expected Value Concepts to Option Investing (Option Alpha)](https://optionalpha.com/blog/how-to-calculate-expected-value)   •&amp;nbsp;[Risk Management  or How to Not Lose Your House (boii0708) (March 6 2021)](https://www.reddit.com/r/options/comments/lyp1uc/risk_management_or_how_to_not_lose_your_house/)   •&amp;nbsp;[Trade Checklists and Guides (Option Alpha)](https://optionalpha.com/members/guides-checklists)     •&amp;nbsp;[Planning for trades to fail. (John Carter)  (at 90 seconds)](https://youtu.be/N5_OkdvPmUI?t=90)     •&amp;nbsp;[Poker Wisdom for Option Traders: The Evils of Results-Oriented Thinking (PapaCharlie9)](https://www.reddit.com/r/options/comments/qfq82a/poker_wisdom_for_option_traders_the_evils_of/)     **Minimizing Bid-Ask Spreads (high-volume options are best)**    •&amp;nbsp;[Price discovery for wide bid-ask spreads (Redtexture)](https://www.reddit.com/r/options/wiki/faq/pages/price_discovery)   •&amp;nbsp;[List of option activity by underlying (Market Chameleon)](https://marketchameleon.com/Reports/optionVolumeReport)     **Closing out a trade**   •&amp;nbsp;[Most options positions are closed before expiration (Options Playbook)](https://www.optionsplaybook.com/options-introduction/closing-option-position/)        •&amp;nbsp;[Risk to reward ratios change: a reason for early exit (Redtexture)](https://www.reddit.com/r/options/wiki/faq/pages/risk_reward_and_exits)     •&amp;nbsp;[Guide: When to Exit Various Positions]( https://www.reddit.com/r/options/wiki/faq/pages/whentoexit)    •&amp;nbsp;[Close positions before expiration: TSLA decline after market close (PapaCharlie9) (September 11  2020)](https://www.reddit.com/r/options/comments/ipqkua/fridays_tsla_lesson_close_positions_before/)    •&amp;nbsp;[5 Tips For Exiting Trades (OptionStalker)]( https://www.reddit.com/r/options/comments/qtwsm5/5_tips_for_exiting_trades/)    •&amp;nbsp;[Why stop loss option orders are a bad idea](https://www.reddit.com/r/options/wiki/faq/pages/stop_loss)     ---  **Options exchange operations and processes**      •&amp;nbsp;[Options Adjustments for Mergers  Stock Splits and Special dividends; Options Expiration creation; Strike Price creation; Trading Halts and Market Closings; Options Listing requirements;  Collateral Rules; List of Options Exchanges; Market Makers](https://www.reddit.com/r/options/wiki/faq/pages/exchange_operations)    •&amp;nbsp;[Options that trade until 4:15 PM (US Eastern) / 3:15 PM (US Central) -- (Tastyworks)](https://support.tastyworks.com/support/solutions/articles/43000435335-options-that-trade-until-3-15-pm-central-)    ---  **Brokers**    •&amp;nbsp;[USA Options Brokers (wiki)](https://www.reddit.com/r/options/wiki/faq/pages/brokers)     •&amp;nbsp;[An incomplete list of international brokers trading USA (and European)  options](https://www.reddit.com/r/options/wiki/faq/pages/brokers/)    ---  **Miscellaneous: Volatility  Options Option Chains &amp; Data  Economic Calendars  Futures Options**    •&amp;nbsp;[Graph of the VIX: S&amp;P 500 volatility index (StockCharts)](https://stockcharts.com/h-sc/ui?s=vix)   •&amp;nbsp;[Graph of VX Futures Term Structure (Trading Volatility)](http://www.tradingvolatility.net/p/datasourceurldocs.html)   •&amp;nbsp;[A selected list of option chain &amp; option data websites](https://www.reddit.com/r/options/wiki/faq/pages/data_sources)   •&amp;nbsp;[Options on Futures (CME Group)](https://www.cmegroup.com/education/files/options-on-futures-brochure.pdf)   •&amp;nbsp;[Selected calendars of economic reports and events](https://www.reddit.com/r/options/wiki/faq/pages/calendars)    ---  Previous weeks' Option Questions Safe Haven threads.    [Complete archive: 2018  2019  2020  2021  2022  2023  2024  2025  2026](https://www.reddit.com/r/options/wiki/faq/archive/safe_haven_2026) ---,PapaCharlie9,2,59,1770657574,EFORE|STING|LEASE|EVIEW|BELOW|LIST|OF|QUENT|SWERS|NEVER|RCISE|YOUR|LONG|CALL|FAQ|FINRA|II|UI|TSLA|PM|USA|VIX|VX|CME,reddit
options,1m1f76i,READ THIS: You can help reduce spam on our sub!,All financial subs are experiencing higher than normal spam traffic. Thanks to the help of many of you  we've put filters in place that catch most of the spam before it can get to the front page  but the spammers are constantly finding ways to work around our filters  so it's a never ending battle of whack-a-mole.  This post is just a quick call to action  summarizing what you should do if you suspect a scammer's spam post:  * Do **NOT** engage on the post by commenting  like "gtfo scammer" or "why aren't mods doing anything about this?" You're just bumping up the engagement stats on the scammer's post and announcing to them that they succeeded in getting past our filters. * Instead  report the post and block the user. The user is almost always a stolen zombie account  so DMing threats to them is pointless and against Reddit's policies anyway. * Finally  **the most important action you can take** is to copy paste the content of the post text as a reply to this thread. We need more samples to improve our filters and since the spammers delete the post before we can capture samples  they elude us. * **EDIT**: When you copy/paste the sample  please isolate any u/name mentions by separating the u / with spaces  so u / name would work. This is to avoid your copy/paste sending a notification to that user. Also  if there is an embedded link in the text  copy out the URL of the link as well. So if the post ends with something like  "Anyway  here's the \[[link](http://scams.are.us/spambotdelux)\] that changed everything " please also copy/paste the link URL  for example  [http://scams.are.us/spambotdelux](http://scams.are.us/spambotdelux)  Both your mod team and Reddit Admins are working hard to stem the tide of this spam  but we still need your help.  For more details about why these new spammers are so difficult to catch  or the specific varieties of spam we are seeing and with more things you can do  this is the link to the original post:  [https://www.reddit.com/r/options/comments/1iyroe9/another\_spambot\_is\_targeting\_us\_similar\_to\_the/](https://www.reddit.com/r/options/comments/1iyroe9/another_spambot_is_targeting_us_similar_to_the/)  Based on comments we've seen  it appears that less than 1% of the entire community have read that original post. It only has 20k views for all-time  while our sub as a whole averages millions of views per month. So this shorter and more call-to-action post replaces it with a more demanding title that hopefully will get more people to read it. We'll see.,PapaCharlie9,54,55,1752678778,READ|THIS|EDIT|URL,reddit
options,1rcu7gx,TSLA 397.5C gained 6150% in the last 4 minutes. Option volume spiked at the exact bottom.,https://preview.redd.it/lmjdu8j19blg1.png?width=320&amp;format=png&amp;auto=webp&amp;s=e01526e492edf0cad7586e4f62162ca077cc2ed1  Some dude turned $100K to $6.1M in 4 minutes. Makes you question your rules and discipline ,ComfortableNo5231,288,75,1771881393,TSLA,reddit
options,1rd04gs,I was wrong about stop losses on 0dte SPX,For context  I trade credit spreads on 0DTE with an automated system ([more info](http://ez-tradebot.com)).  I have a system that relies on detecting breakout moves from the opening range mechanically.  Delta is targeted dynamically from the OR and a fixed delta target. I experimented with many different possible combinations of delta target (3  5  10) that the optimizer uses for strike selection.  I reasoned that theoretically  a lower delta target with higher quantity would hold up better out of sample because of something called Skewness Risk Premium - the idea that further out of the money options have higher implied volatility to compensate for how skewed the risk/reward is of the position  making it highly undesirable for institutions to sell those options.  But when I ran the numbers  time and time again stops created more problems than they solved. For one  they locked in many  many losses that ended up recovering the same day. For another  they only worked at low deltas where the stop was never even hit in sample. Stress test scenarios found even setting the stop to a 5 point breach led to a 30-40% loss on the spread. And that's assuming QuantConnect modeled fills well - it honestly will probably be worse live.  Eventually  I reached the conclusion that from a risk management perspective  trying to harvest too much skew and compensating with quantity is not a good idea.  Fills end up being worse than the backtest modeled  fees end up eating most of the gains  and worst of all  there is the existential risk of having to risk the entire account and hoping that the code you wrote for the stop loss actually works that one day when it's all on the line.  Ultimately  I found stop losses just don't work in 0dte credit spread selling  the way I was doing it. Even set very  very far OTM  the stop loss ends up being more of a liability than anything. It turns out the extra Sharpe I found in my first iterations was just luck having to do with setting the starting capital to 10K.  When I changed the starting capital to 20k  it actually underperformed the more robust version I now use - risk 30% and use no stops  and sell higher delta.,Right_Business9301,21,19,1771894982,SPX|DTE|OTM,reddit
options,1rcvaac,Optionstrat  not good,I opened a sub on the black Friday deal back in November  solely for the net Greeks calculator.  I do multiple dated strategies  keeping an eye on total net Theta and Vega.  A Few weeks ago I opened a series of SPY spreads because the chart was nicely green and Theta was through the roof  only to wind up head scratching as I watched the positions flounder all day  so I checked and tallied the Greeks to learn Optionstrat had a glitched Theta on a single put by over 150.  Today my account should be up  but it only traded flat  so again I tallied the Greeks to find Optionstrat's Vega was almost double what the actual positions were.  I hedge Vega with VIX options  (dated spreads are Vega positive)  I checked my broker's numbers and added several times and my numbers were right.  Does anyone know of another platform that calculates net Greeks in real time?  Optionstrat isn't cutting it.     \*\*\*\*\*\*\*\*\*\*\*\*\*\*\*\*\*\*\*\*\*\*\*\*\*\*\*\*\*\*\*\*\*\*\*\*\*\*\*\*\*\*\*\*\*\*\*\*\*\*\*\*  EDIT: Was going to delete to save face  but decided to do right and mention I discovered I'd doubled the quantityof options I'm holding  therefore had double the Greeks  problem fixed  though it would be nice if the option symbols had a numeric display on them so we could see positions that may have more than one  and  to avoid idiotic mistakes like mine.,Krammsy,4,12,1771883767,SPY|VIX|EDIT,reddit
options,1rcodyu,Historical Options data,Hi everyone   I'm writing my thesis on **earnings volatility mispricing in options markets**. Specifically  I'm testing whether implied volatility is systematically overpriced around corporate earnings announcements  and whether this varies between large-cap and small-cap stocks.  **What I need:**  * Implied volatility * Greeks (delta  gamma  vega  theta) * Bid-ask spreads  **What I've tried:**  * WRDS OptionMetrics (requested access  denied) * LSEG Workspace (limited historical availability)  **My question:** Are there any other academic or affordable data sources I'm missing? Or does anyone have experience downloading this type of data for research?  Any suggestions appreciated!  PD: I obviously would prefer free data as I'm a student and can pay the thousands of dollars they ask me for this data  Edit: Ivolatility has a free trial for 7 days which can be used to download all the necessary data,Aggressive-Knee5635,3,6,1771868969,WRDS|LSEG|PD,reddit
options,1rcugrl,Using VIX1D / VIX9D to Choose Structures.,https://preview.redd.it/ueio19rh9blg1.png?width=791&amp;format=png&amp;auto=webp&amp;s=43b487ee295d6ad0f4173d1747f7e4716dd59bdd  Today VIX 9 day spiked immensely  while VIX 1 day lagged greatly behind. This made structures like double calendar longs very expensive  and shorts pay very little premium.  I've studied options structures and completed what felt like mastering my understanding  then the greeks. The last part of the puzzle to tying it all in is understanding volatility.  Front end IV vs back end IV  or the IV curvature. After structures  greeks  this is the most important and last missing piece to gauge which tools for which occasion.  What websites do you use for this data? What learning materials did you read to understand this better? I'd greatly appreciate any comments from those who've mastered structures  greeks and IV curvature if that's even the right lingo and put it all together. Thank you.,breakyourteethnow,3,2,1771881949,VIX|IV,reddit
